Question,Choice1,Choice2,Choice3,Choice4,Choice5,Answer,Explane
A developer needs a way to automatically provision a collection of AWS resources. Which AWS service is primarily used for deploying infrastructure as code?,1. AWS Elastic Beanstalk,2. Amazon CloudFormation,3. AWS CodeDeploy,4. Jenkins,,2. Amazon CloudFormation,"Aws cloudformation is a service that gives developers and businesses an easy way to create a collection of related AWS resources and provision them in an orderly and predictable fashion. AWS CloudFormation provides a common language for you to describe and provision all the infrastructure resources in your cloud environment. Think of CloudFormation as deploying infrastructure as code
Elastic Beanstalk is more focussed on deploying applications on EC2 (PaaS)
AWS CodeDeploy is a fully managed deployment service that automates software deployments to a variety of compute services such as Amazon EC2, AWS Lambda, and your on-premises servers
Jenkins deploys infrastructure as code but is not an AWS service"
Select the statements that are correct in relation to Amazon Route 53? (choose 2),1. Amazon Route 53 is an internal elastic load balancer,2. You can register domain names via Amazon Route 53,3. Amazon Route 53 does not support SPF records,4. Amazon Route 53 supports Alias and CNAME records,5. Amazon Route 53 can be used to connect on-premises data centers to the AWS cloud,"2. You can register domain names via Amazon Route 53, 4. Amazon Route 53 supports Alias and CNAME records","Amazon route 53 is a highly available and scalable domain name system (dns) service Route 53 offers the following functions: - Domain name registry - DNS resolution
- Health checking of resources
Health checks verify Internet connected resources are reachable, available and functional Routing policies include Simple, Weighted, Latency-based, Failover and Geo-Location Many record types are supported including Alias and CNAME
Internal elastic load balancing is performed by the Amazon ELB
It does not support connecting on-premises data centers to the cloud - this is done by Direct Connect"
"Assuming you have configured them correctly, which AWS services can scale automatically without intervention? (choose 2)",1. Amazon RDS,2. Amazon EC2,3. Amazon S3,4. Amazon DynamoDB,5. Amazon EBS,"3. Amazon S3, 4. Amazon DynamoDB","Both s3 and dynamodb automatically scale as demand dictates. in the case of dynamodb you can either configure the on-demand or provisioned capacity mode. With on-demand capacity mode DynamoDB automatically adjusts the read and write throughput for you
EC2 cannot scale automatically. You need to use Auto Scaling to scale the number of EC2 instances deployed
EBS and RDS do not scale automatically. You must intervene to adjust volume sizes and database instance types to scale these resources"
"To reward customers for using their services, what are two ways AWS reduce prices? (choose 2)",1. Volume based discounts when you use more services,2. Reduction in inbound data transfer charges,3. Reduced cost for reserved capacity,4. Discounts for using a wider variety of services,5. Removal of termination fees for customers who spend more,"1. Volume based discounts when you use more services, 3. Reduced cost for reserved capacity","Aws provide volume based discount so that when you use more services you reduce the cost per service. You can also reserve capacity by locking in to fixed 1 or 3 year contracts to get significant discounts
You never pay for inbound data transfer
You don't get discounts for using a variety of services, only when you use more services There are never termination fees with AWS"
How can a company connect from their on-premises network to VPCs in multiple regions using private connections?,1. AWS Managed VPN,2. AWS Direct Connect Gateway,3. Amazon CloudFront,4. Inter-Region VPC Peering,,2. AWS Direct Connect Gateway,"You can use an aws direct connect gateway to connect your aws direct connect connection over a private virtual interface to one or more VPCs in your account that are located in the same or different Regions
AWS Managed VPN uses the public Internet and is therefore not a private connection Amazon CloudFront is a content delivery network used for caching data
Inter-Region VPC peering does not help you to connect from an on-premise network"
Which AWS components aid in the construction of fault-tolerant applications? (choose 2),1. Elastic IP addresses,2. ARNs,3. AMIs,4. Tags,5. Block device mappings,"1. Elastic IP addresses, 3. AMIs","Elastic ip addresses can be easily remapped between ec2 instances in the event of a failure. Amazon Machine Images (AMIs) can be used to quickly launch replacement instances when there is a failure
Amazon Resource Names (ARNs), tags and block device mappings don't really help with fault tolerance"
What offerings are included in the Amazon Lightsail product set? (choose 2),1. Virtual Private Server,2. NoSQL database,3. Managed MySQL database,4. Object storage,5. Serverless functions,"1. Virtual Private Server, 3. Managed MySQL database","Amazon lightsail provides an easy, low cost way to consume cloud services without needing the skill set for using VPC resources. The product set includes virtual private servers (instances), managed MySQL databases, HA storage, and load balancing
You can connect to other AWS services such as S3, DynamoDB, and CloudFront, however these are not part of the Lightsail product range"
Which of the following are advantages of using the AWS cloud computing over legacy IT? (choose 2),1. You are able to pass responsibility for the availability of your application to AWS,2. You don't need to worry about over provisioning as you can elastically scale,3. You don't need to patch your operating systems,4. You can bring new applications to market faster,5. You can bring services closer to your end users,"2. You don't need to worry about over provisioning as you can elastically scale, 4. You can bring new applications to market faster","With cloud computing you no longer need to guess about capacity as you can elastically scale. This means you don't end up overprovisioning but instead react to the load on your servers. You can also be faster and more agile with development and release of applications
You do not pass responsibility for your application to AWS. AWS runs the infrastructure but you still manage the application
You still need to patch your own operating systems
The cloud is centralized so you won't necessarily bring services closer to your end users"
Which type of Amazon EBS volume do AWS suggest customers use for the boot volume of most workloads?,1. General Purpose SSD,2. Provisioned IOPS SSD,3. Throughput Optimized HDD,4. Cold HDD,,1. General Purpose SSD,"Aws suggest that the general purpose ssd is used for the boot volume of most workloads
Provisioned IOPS SSD is for high performance applications that require sustained IOPS
Throughput Optimized HDD is for streaming workloads with fast throughput requirements Cold HDD is the lowest cost HDD and is for infrequently accessed data"
What charges are applicable to Amazon S3 Standard storage class? (choose 2),1. Per GB/month storage fee,2. Retrieval fee,3. Minimum capacity charge per object,4. Data ingress,5. Data egress,"1. Per GB/month storage fee, 5. Data egress","With the standard storage class, you pay a per gb/month storage fee, and data transfer out of S3 
Standard-IA and One Zone-IA have a minimum capacity charge per object Standard-IA, One Zone-IA, and Glacier also have a retrieval fee You don't pay for data into S3 under any storage class"
An engineer launched a new EC2 instance and it was immediately terminated. What is the most likely reason?,1. The user does not have the permissions to launch EC2 instances,2. The AZ does not have any capacity left,3. The account has reached its On-Demand instance limit for the region,4. The AMI was deleted,,3. The account has reached its On-Demand instance limit for the region,"You are limited to running up to a total of 20 on-demand instances across the instance family, purchasing 20 Reserved Instances, and requesting Spot Instances per your dynamic Spot limit per region
If a user did not have permissions to launch an instance then it would not launch at all, rather than launching and then terminating
If the AZ did not have capacity, or the AMI was deleted the instance would not launch"
How can a company connect their EC2 instances in one region with EC2 instances in another region using private IP addresses?,1. Inter-Region VPC Peering,2. AWS Direct Connect,3. AWS Managed VPN,4. VPC Peering,,1. Inter-Region VPC Peering,"Amazon ec2 now allows peering relationships to be established between virtual private Clouds (VPCs) across different AWS regions. Inter-Region VPC Peering allows VPC resources like EC2 instances, RDS databases and Lambda functions running in different AWS regions to communicate with each other using private IP addresses, without requiring gateways, VPN connections or separate network appliances
VPC Peering is used to peer VPCs within the same region
AWS Direct Connect is a private connection from an on-premise network to an AWS region, it does not enable connectivity between regions (unless you use Direct Connect Gateway)"
Which of the following descriptions is incorrect in relation to the design of Availability Zones?,"1. AZ’s have direct, low-latency, high throughput and redundant network connections betweeneach other",2. Each AZ is designed as an independent failure zone,3. AZs are physically separated within a typical metropolitan region and are located in lowerrisk flood plains,4. Each subnet in a VPC is mapped to all AZs in the region,,4. Each subnet in a VPC is mapped to all AZs in the region,Subnets are created within a single az and do not get mapped to multiple azs
"When designing a VPC, what is the purpose of an Internet Gateway?",1. Provides Internet access for EC2 instances in private subnets,2. Enables Internet communications for instances in public subnets,3. It's a bastion host for inbound management connections,4. It's used for making VPN connections to a VPC,,2. Enables Internet communications for instances in public subnets,"An internet gateway is a horizontally scaled, redundant, and highly available vpc component that allows communication between instances in your VPC and the internet. It therefore imposes no availability risks or bandwidth constraints on your network traffic
An internet gateway serves two purposes: to provide a target in your VPC route tables for internet-routable traffic, and to perform network address translation (NAT) for instances that have been assigned public IPv4 addresses
You cannot use an Internet Gateway as a bastion host, deploy an EC2 instance in a public subnet for this purpose
You cannot connect instances in a private subnet to the Internet using an Internet Gateway, you  need a NAT Gateway or NAT Instance for this purpose
You cannot use the Internet Gateway for making VPN connections to a VPC, you need a Virtual Private Gateway for this purpose"
"In Amazon CloudWatch, which of the following Amazon EC2 data points requires a custom metric to monitor?",1. Memory utilization,2. CPU utilization,3. Disk write operations,4. Network packets in,,1. Memory utilization,"The aws/ec2 namespace includes the following instance metrics: CPUUtilization
DiskReadOps
DiskWriteOps
DiskReadBytes
DiskWriteBytes
NetworkIn
NetworkOut
NetworkPacketsIn
NetworkPacketsOut"
Which of the following configuration items are important to enabling an EC2 web server to serve  web pages on the Internet? (choose 2),1. Security group rules configured to allow HTTP/HTTPS,2. A private IP address assigned to the instance,3. Security groups rules configured to allow SSH,4. A public IP address assigned to the instance,5. An established VPN connection,"1. Security group rules configured to allow HTTP/HTTPS, 4. A public IP address assigned to the instance","To connect to a web page on a web server you use the http/https protocol. you therefore need to ensure the instance's security group allows these protocols in an inbound rule
A public IP address assigned to an instance in a public subnet is required in order to be able to directly access the instance from the Internet. There also needs to be an Internet Gateway attached to the VPC and an entry in the route table for the subnet that points to it
A private IP address will always be assigned to instances in EC2, but these do not enable access from the Internet
An established VPN connection is not required, connections will come through an Internet Gateway to a public subnet"
How can a company protect their Amazon S3 data from a regional disaster?,1. Archive to Amazon Glacier,2. Use Cross-Region Replication (CRR) to copy to another region,3. Use lifecycle actions to move to another S3 storage class,4. Enable Multi-Factor Authentication (MFA) delete,,2. Use Cross-Region Replication (CRR) to copy to another region,"The only option here that will help is to use crr to copy the data to another region. this will provide disaster recovery
Moving to Glacier or another S3 storage class does not copy the data out of the region Enabling MFA delete will not protect the data from a regional disaster"
Which of the following is NOT an AWS service used for transferring large amounts of data into Amazon S3?,1. AWS Snowball,2. AWS Snowmobile,3. S3 Transfer Acceleration,4. AWS DMS,,4. AWS DMS,Aws dms is used for migrating databases into or within aws All other options are valid services that are used for transferring large amounts of data into Amazon S3
How do AWS charge for Amazon CloudFront? (choose 2),1. Data transfer out,2. Data transfer in,3. Number of requests,4. Number of users,5. Uptime,"1. Data transfer out, 3. Number of requests","With amazon cloudfront the basic elements you are charged for include the amount of data transfer out and the number of requests. There are additional chargeable items such as  invalidation requests, field-level encryption requests, and custom SSL certificates"
"Which AWS service is part of the suite of ""serverless"" services and runs code as functions?",1. Amazon ECS,2. Amazon EKS,3. AWS Lambda,4. AWS CodeCommit,,3. AWS Lambda,"Aws lambda is a serverless compute service that runs your code in response to events and automatically manages the underlying compute resources for you. The code you run on AWS Lambda is called a “Lambda function”
Amazon ECS and EKS are both used for running software containers such as Docker containers
AWS CodeCommit is a fully-managed source control service that hosts secure Git-based repositories"
How do AWS charge for the use of NAT Gateways? (choose 2),1. Price per gateway hour,2. Price per port,3. Price per GB processed,4. Price per instance session,5. Price per protocol,"1. Price per gateway hour, 3. Price per GB processed","If you choose to create a nat gateway in your vpc, you are charged for each “nat
Gateway-hour"" that your NAT gateway is provisioned and available. Data processing charges apply for each Gigabyte processed through the NAT gateway regardless of the traffic’s source or destination"
What type of cloud computing service type do AWS Elastic Beanstalk and Amazon RDS correspond to?,1. IaaS,2. PaaS,3. SaaS,4. Hybrid,,2. PaaS,"Both elastic beanstalk and rds are services that are managed at the platform level meaning you don't need to manage the infrastructure level yourself. Therefore, tasks like OS management and patching are performed for you
IaaS is a model where the underlying hardware platform and hypervisor are managed for you and you are delivered tools and interfaces for working with operating system instances
SaaS is a model where the whole stack is managed for you right up to the application and you are delivered working software that you can customize and populate with data
Hybrid is a type of cloud delivery model in which you consume both public and private cloud and connect the two together"
Which types of scaling policies are available when using AWS Auto Scaling? (choose 2),1. Simple scaling,2. Deferred scaling,3. Agile scaling,4. Step scaling,5. Warm scaling,"1. Simple scaling, 4. Step scaling","With aws auto scaling the scaling policies include: simple, scheduled, dynamic, and step scaling
The other options are bogus and do not exist"
Which type of Elastic Load Balancer only distributes traffic using the TCP protocol information?,1. Application Load Balancer (ALB),2. Network Load Balancer (NLB),3. Classic Load Balancer (CLB),4. No load balancers operate at the TCP level,,2. Network Load Balancer (NLB),"Nlbs process traffic at the tcp level (layer 4)
ALBs process traffic at the HTTP, HTTPS level (layer 7)
CLBs process traffic at the TCP, SSL, HTTP and HTTPS levels (layer 4 & 7)"
"How can a company configure automatic, asynchronous copying of objects in Amazon S3 buckets across regions?",1. This is done by default by AWS,2. By configuring multi-master replication,3. Using cross-region replication,4. Using lifecycle actions,,3. Using cross-region replication,"Cross-region replication (crr) enables automatic, asynchronous copying of objects across buckets in different AWS Regions. Buckets configured for cross-region replication can be owned by the same AWS account or by different account
Multi-master replication is not something you can do with Amazon S3 (Amazon Aurora has this feature)
Lifecycle actions cannot be configured to move to another storage class in a different region"
"A web server is being maliciously targeted, how a systems administrator deny access from a list of known attacker IP addresses? (choose 2)",1. Using a local firewall such as iptables,2. Using a rule on the Internet Gateway,3. Using a Security Group deny rule,4. Using a Network ACL deny rule,5. Through VPC route table configuration,"1. Using a local firewall such as iptables, 4. Using a Network ACL deny rule","To block access to a known list of ip addresses you can configure a local firewall on the web server or use Network ACL deny rules
You cannot create deny rules with Security Groups (only allow rules)
Internet Gateways do not have allow/deny rules and route table configuration could not be used to break connections with specific addresses"
How can a Solutions Architect reduce the latency between end-users and applications or content? (choose 2),1. Deploy applications in multiple AZs,2. Deploy applications in regions closest to the end-users,3. Use S3 Transfer Acceleration to improve application performance,4. Use Amazon CloudFront to cache content closer to end-users,5. Use larger EC2 instance types for the applications,"2. Deploy applications in regions closest to the end-users, 4. Use Amazon CloudFront to cache content closer to end-users","To reduce latency, which corresponds with the distance over which network communications travel, you should aim to host your applications closer to your end-users. This means deploying them in the closest regions
Deploying in multiple AZs may create resiliency but won't change latency much as AZs are geographically close to each other
S3 Transfer Acceleration is used to improve upload speeds for S3 objects and does not affect application performance
CloudFormation is used for deploying resources through code (""infrastructure as code"")
Using a larger instance type for your application may improve application performance but will not reduce latency"
What is an example of scaling vertically?,1. AWS Auto Scaling adding more EC2 instances,2. AWS Lambda adding concurrently executing functions,3. Increasing the instance size with Amazon RDS,4. Adding read replicas to an Amazon RDS database,,3. Increasing the instance size with Amazon RDS,"A good example of vertical scaling is changing the instance size of an ec2 instance or rds database to one with more CPU and RAM
All of the other options are examples of scaling horizontally"
"To reduce cost, which of the following services support reservations? (choose 2)",1. Amazon ElastiCache,2. Amazon CloudFormation,3. Amazon RedShift,4. AWS Elastic Beanstalk,5. Amazon S3,"1. Amazon ElastiCache, 3. Amazon RedShift","Amazon elasticache and redshift both support reserved nodes
The use of CloudFormation and Elastic Beanstalk is not chargeable so you can't reserve anything
Amazon S3 is a pure pay per use service, you cannot reserve capacity"
Which of the following is not a best practice for protecting the root user of an AWS account?,1. Don’t share the root user credentials,2. Enable MFA,3. Remove administrative permissions,4. Lock away the AWS root user access keys,,3. Remove administrative permissions,"You cannot remove administrative permissions from the root user of an aws account. Therefore, you must protect the account through creating a complex password, enabling MFA, locking away access keys (assuming they're even required), and not sharing the account details"
Which AWS database service is a SQL database that supports complex queries and joins?,1. Amazon DynamoDB,2. Amazon ElastiCache,3. Amazon SimpleDB,4. Amazon RDS,,4. Amazon RDS,"Amazon rds is a relational database of the sql type and can be used for complex queries and joins
All other options listed are NoSQL types of database which are not suitable for complex queries and joins"
You are evaluating AWS services that can assist with creating scalable application environments. Which of the statements below best describes the Elastic Load Balancer service?,1. Helps you ensure that you have the correct number of Amazon EC2 instances available tohandle the load for your application,2. A highly available and scalable Domain Name System (DNS) service,"3. Automatically distributes incoming application traffic across multiple targets, such asAmazon EC2 instances, containers, and IP addresses",4. A network service that provides an alternative to using the Internet to connect customers’ onpremise sites to AWS,,"3. Automatically distributes incoming application traffic across multiple targets, such asAmazon EC2 instances, containers, and IP addresses","Elastic load balancing automatically distributes incoming application traffic across multiple targets, such as Amazon EC2 instances, containers, and IP addresses
Elastic Load Balancing provides fault tolerance for applications by automatically balancing traffic across targets – Amazon EC2 instances, containers and IP addresses – and Availability Zones while ensuring only healthy targets receive traffic"
What are two of the core concepts related to Amazon SNS? (choose 2),1. Topics,2. Conversations,3. Subscriptions,4. Templates,5. Tables,"1. Topics, 3. Subscriptions","The core concepts of sns are:
- Topics – how you label and group different endpoints that you send messages to - Subscriptions – the endpoints that a topic sends messages to
- Publishers – the person/alarm/event that gives SNS the message that needs to be sent"
A Solutions Architect needs to design a cloud-native application architecture using AWS services. What is a typical use case for Amazon Simple Queue Service (SQS)?,1. Providing fault tolerance for EC2 instances,2. Co-ordination of work items between different human and non-human workers,3. Decoupling application components to ensure that there is no dependency on the availabilityof a single component,4. Running serverless processes as functions,,3. Decoupling application components to ensure that there is no dependency on the availabilityof a single component,"Amazon simple queue service (sqs) is a fully managed message queuing service that enables you to decouple and scale microservices, distributed systems, and serverless applications"
Which AWS technology enables you to group resources that share one or more tags?,1. Tag groups,2. Organization groups,3. Resource groups,4. Consolidation groups,,3. Resource groups,"Resource groups make it easy to group resources using the tags that are assigned to them. you can group resources that share one or more tags
The other options are bogus and do not exist"
Which AWS security tool uses an agent installed in EC2 instances and assesses applications for vulnerabilities and deviations from best practices?,1. AWS Trusted Advisor,2. AWS Personal Health Dashboard,3. AWS TCO Calculator,4. AWS Inspector,,4. AWS Inspector,"Inspector is an automated security assessment service that helps improve the security and compliance of applications deployed on AWS. Inspector automatically assesses applications for vulnerabilities or deviations from best practices. Uses an agent installed on EC2 instances Trusted Advisor is an online resource that helps to reduce cost, increase performance and improve security by optimizing your AWS environment
AWS Personal Health Dashboard provides alerts and remediation guidance when AWS is  experiencing events that may impact you
The AWS TCO calculator can be used to compare the cost of running your applications in an on-premises or colocation environment to AWS"
"You need to provision a single EBS volume that is 500 GiB in size and needs to support 20,000 IOPS. Which EBS volume type will you select?",1. General Purpose SSD,2. Provisioned IOPS SSD,3. Throughput Optimized HDD,4. Cold HDD,,2. Provisioned IOPS SSD,"Provisioned iops ssd supports up to 50 iops per gib with up to 32,000 iops per volume
General purpose SSD supports 3 IOPS per GiB and can burst up to 3000 IOPS (volumes > 334GB), and a maximum of 10,000 per volume
The HDD options provide much lower IOPS per volume (500, 250)"
