Question,Choice1,Choice2,Choice3,Choice4,Choice5,Answer,Explane
Which AWS service is primarily used for software version control?,1. AWS CodeCommit,2. AWS CodeStar,3. AWS Cloud9,4. AWS CodeDeploy,,1. AWS CodeCommit,"Aws codecommit is a fully-managed source control service that hosts secure git-based repositories. It makes it easy for teams to collaborate on code in a secure and highly scalable ecosystem
AWS CodeStar enables you to quickly develop, build, and deploy applications on AWS. AWS CodeStar provides a unified user interface, enabling you to easily manage your software development activities in one place
AWS Cloud9 is a cloud-based integrated development environment (IDE) that lets you write, run, and debug your code with just a browser
AWS CodeDeploy is a deployment service that automates application deployments to Amazon EC2 instances, on-premises instances, or serverless Lambda functions"
Which AWS service can you use to install a third-party database?,1. Amazon RDS,2. Amazon DynamoDB,3. Amazon EC2,4. Amazon EMR,,3. Amazon EC2,All of these services are managed services except for amazon ec2. ec2 is the only service in the list upon which you can manually install the database software of your choice
Identify the services that have a global (rather than regional) scope? (choose 2),1. Amazon Route 53,2. Amazon S3,3. Amazon CloudFront,4. AWS Lambda,5. Amazon EC2,"1. Amazon Route 53, 3. Amazon CloudFront","Amazon route 53 and amazon cloudfront have a global scope
Amazon S3 uses a global namespace but buckets and objects are created within a region AWS Lambda is a regional service"
Which service can you use to provision a preconfigured server with little to no AWS experience?,1. Amazon Elastic Beanstalk,2. AWS Lambda,3. Amazon EC2,4. Amazon Lightsail,,4. Amazon Lightsail,"Lightsail provides developers compute, storage, and networking capacity and capabilities to deploy and manage websites, web applications, and databases in the cloud
Lightsail provides preconfigured virtual private servers (instances) that include everything required to deploy and application or create a database
Deploying a server on Lightsail is extremely easy and does not require knowledge of how to configure VPCs, security groups, network ACLs etc. AWS Elastic Beanstalk can be used to quickly deploy and manage applications in the AWS Cloud. It is considered a PaaS service. However, you do still need to deploy within a VPC so more AWS expertise is required
Amazon EC2 also requires AWS expertise as it deploys within a VPC
AWS Lambda provides serverless functions not preconfigured servers"
Which AWS service allows you to connect to storage from on-premise servers using standard file protocols?,1. Amazon S3,2. Amazon EBS,3. Amazon Glacier,4. Amazon EFS,,4. Amazon EFS,"Efs is a fully-managed service that makes it easy to set up and scale file storage in the Amazon Cloud
EFS filesystems are mounted using the NFS protocol (which is a file-level protocol)
Access to EFS file systems from on-premises servers can be enabled via Direct Connect or 
AWS VPN
You mount an EFS file system on your on-premises Linux server using the standard Linux mount command for mounting a file system via the NFSv4.1 protocol Amazon S3 is an object-level not file-level storage system
Amazon Glacier is an archiving solution that is accessed through S3
Amazon Elastic Block Storage (EBS) is block-level storage that can only be accessed by EC2 instances from the same AZ as the EBS volume"
Which pricing model should you use for EC2 instances that will be used in a lab environment for several hours on a weekend and must run uninterrupted?,1. On-Demand,2. Reserved,3. Spot,4. Dedicated Instance,,1. On-Demand,"Spot instances are good for short term requirements as they can be very economical. However, you may find that the instance is terminated if the spot market price moves
On-Demand is the best choice for this situation as it is the most economical option that will ensure no interruptions
Reserved instances are good for long-term, static requirements as you must lock-in for 1 or 3 years in return for a decent discount
Dedicated instances are EC2 instances that run on hardware dedicated to a single customer"
What is an availability zone composed of?,1. One or more regions,2. One or more DCs in a location,3. A collection of edge locations,4. A collection of VPCs,,2. One or more DCs in a location,"Availability zones are physically separate and isolated from each other
AZ’s have direct, low-latency, high throughput and redundant network connections between each other
A region is a geographical area
Each region consists of 2 or more availability zones"
Which AWS services are used for analytics? (choose 2),1. Amazon RDS,2. Amazon ElastiCache,3. Amazon Athena,4. Amazon S3,5. Amazon EMR,"3. Amazon Athena, 5. Amazon EMR","Amazon elastic map reduce (emr) provides a managed hadoop framework that makes it easy, fast, and cost-effective to process vast amounts of data across dynamically scalable Amazon EC2 instance
Amazon Athena is an interactive query service that makes it easy to analyze data in Amazon S3 using standard SQL
ElastiCache is a data caching service that is used to help improve the speed/performance of web applications running on AWS Amazon RDS is Amazon's relational database and is primarily used for transactional workloads 
Amazon S3 is used for object storage"
What advantages does deploying Amazon CloudFront provide? (choose 2),1. A private network link to the AWS cloud,2. Reduced latency,3. Automated deployment of resources,4. Improved performance for end users,5. Provides serverless compute services,"2. Reduced latency, 4. Improved performance for end users","Cloudfront is a content delivery network (cdn) that allows you to store (cache) your content at “edge locations” located around the world
This allows customers to access content more quickly and provides security against DDoS attacks
CloudFront can be used for data, videos, applications, and APIs
A private network link to the AWS cloud can be provisioned using AWS Direct Connect or an IPSec VPN
Automated deployment of resources is performed using CloudFormation CloudFront is a CDN not a serverless compute service"
What considerations are there when choosing which region to use? (choose 2),1. Data sovereignty,2. Available storage capacity,3. Latency,4. Pricing in local currency,5. Available compute capacity,"1. Data sovereignty, 3. Latency","You may choose a region to reduce latency, minimize costs, or address regulatory requirements
Available capacity is generally not a concern as AWS has a large pool of resources and does not disclose the available capacity in each region Pricing for AWS services is in USD"
Which service can be used to track the CPU usage of an EC2 instance?,1. Amazon CloudTrail,2. Amazon CloudFront,3. Amazon CloudFormation,4. Amazon CloudWatch,,4. Amazon CloudWatch,"Amazon cloudwatch is a monitoring service for aws cloud resources and the applications you run on AWS CloudWatch is for performance monitoring, whereas CloudTrail is for auditing
AWS CloudTrail is a web service that records activity made on your account and delivers log files to an Amazon S3 bucket
CloudFormation is used for automated provisioning of infrastructure
CloudFront is a content delivery network (CDN) that caches content"
Which feature of AWS allows you to deploy a new application for which the requirements may change over time?,1. Elasticity,2. Fault tolerance,3. Disposable resources,4. High availability,,1. Elasticity,"Elasticity allows you to deploy your application without worrying about whether it will need more or less resources in the future. With elasticity, the infrastructure can scale on-demand Fault tolerance and high availability are mechanisms used for ensuring the availability of your application and protecting against the failure of hardware or software components
Disposable resources is an architectural principle in which servers and other components are treated as temporary resources and are replaced rather than updated"
Which items can be configured from within the VPC management console? (choose 2),1. Subnets,2. Regions,3. Load Balancing,4. Auto Scaling,5. Security Groups,"1. Subnets, 5. Security Groups","Subnets and security groups can be configured from within the vpc console Regions are not configured, resources within regions are configured 
Load balancing and auto scaling is configured from the EC2 console"
Which services are integrated with KMS encryption? (choose 2),1. Amazon RDS,2. Amazon EC2,3. Amazon EBS,4. Amazon SWF,5. AWS CloudFormation,"1. Amazon RDS, 3. Amazon EBS",Not all services integrate with kms. review the reference below
Which service allows you to automatically expand and shrink your application in response to demand?,1. AWS ElastiCache,2. Amazon Elastic Load Balancing,3. AWS Auto Scaling,4. Amazon DynamoDB,,3. AWS Auto Scaling,"Auto scaling automatically responds to demand by adding or removing ec2 instances to ensure the right amount of compute capacity is available at any time
Amazon ELB distributes incoming requests to EC2 instances. It can be used in conjunction with Auto Scaling 
AWS Elasticache provides in-memory cache and database services Amazon DynamoDB is a NoSQL database"
The AWS global infrastructure is composed of? (choose 2),1. Regions,2. Clusters,3. Fault Zones,4. Availability Zones,5. IP subnets,"1. Regions, 4. Availability Zones","The aws global infrastructure is built around regions and availability zones (azs) A Region is a physical location in the world where AWS have multiple AZs
AZs consist of one or more discrete data centers, each with redundant power, networking, and connectivity, housed in separate facilities"
Which of the statements below is accurate regarding Amazon S3 buckets? (choose 2),1. Bucket names must be unique regionally,2. Buckets are replicated globally,3. Bucket names must be unique globally,4. Buckets are region-specific,5. Buckets can contain other buckets,"3. Bucket names must be unique globally, 4. Buckets are region-specific","S3 uses a universal (global) namespace, which means bucket names must be unique globally. However, you create the buckets in a region and the data never leaves that region unless explicitly configured to do so through cross-region replication (CRR)
Objects within a bucket are replicated within a region across multiple AZs (except for the One-Zone IA class)
You cannot create nested buckets"
"Which AWS storage technology can be considered a ""virtual hard disk in the cloud""?",1. Amazon Elastic File Storage (EFS) filesystem,2. Amazon Elastic Block Storage (EBS) volume,3. Amazon S3 object,4. Amazon Glacier archive,,2. Amazon Elastic Block Storage (EBS) volume,"An ebs volume is a block storage device that is most similar to a virtual hard disk in the cloud as when attached to an instance it appears as a local disk that can have an operating system installed on or be formatted and used for any other local storage purpose
An EFS filesystem is mounted over the NFS protocol which is a file-level protocol. Therefore, it is a network filesystem not a virtual hard disk and cannot have an operating system installed or be formatted and used as a locally attached disk
S3 is an object storage system and cannot be mounted and used as a virtual hard drive
Glacier is an archiving solution where you can archive your S3 objects at extremely low cost"
Which service records API activity on your account and delivers log files to an Amazon S3 bucket?,1. Amazon CloudWatch,2. Amazon S3 Event Notifications,3. Amazon CloudTrail,4. Amazon CloudWatch Logs,,3. Amazon CloudTrail,"Aws cloudtrail is a web service that records activity made on your account and delivers log files to an Amazon S3 bucket
CloudTrail is for auditing (CloudWatch is for performance monitoring)
S3 Event Notifications is a feature that notifies you when certain events happen in your S3 buckets, it does not record API activity at the account level
Amazon CloudWatch Logs lets you monitor and troubleshoot your systems and applications using your existing system, application and custom log files"
The IAM service can be used to manage which objects? (choose 2),1. Security groups,2. Access policies,3. Roles,4. Network ACLs,5. Key pairs,"2. Access policies, 3. Roles","Access policies are objects that you attach to entities and resources to define their permissions
Roles are created and then “assumed” by trusted entities and define a set of permissions for making AWS service requests
Security groups and network ACLs are used as instance-level and subnet-level firewalls respectively
Key pairs are created in EC2 and are used to login to EC2 instances. Don't confuse these with access keys and secret IDs which are used to grant programmatic access to resources"
Which types of pricing policies does AWS offer? (choose 2),1. Pay-as-you-go,2. Enterprise license agreement (ELA),3. Non-peak hour discounts,4. Global usage discounts,5. Save when you reserve,"1. Pay-as-you-go, 5. Save when you reserve","Amazon pricing includes options for pay-as-you-go, save when you reserve and pay less by using more Amazon does not offer ELAs, non-peak hour discounts, or global usage discounts"
Which tool enables you to visualize your usage patterns over time and to identify your underlying cost drivers?,1. AWS Simple Monthly Calculator,2. Total Cost of Ownership (TCO) Calculator,3. AWS Cost Explorer,4. AWS Budgets,,3. AWS Cost Explorer,"The aws cost explorer is a free tool that allows you to view charts of your costs. you can view cost data for the past 13 months and forecast how much you are likely to spend over the next three months. Cost Explorer can be used to discover patterns in how much you spend on AWS resources over time and to identify cost problem area
The TCO calculator is a free tool provided by AWS that allows you to estimate the cost savings of using the AWS Cloud vs. using an on-premised data center
The AWS Simple Monthly Calculator helps customers and prospects estimate their monthly AWS bill more efficiently
AWS Budgets gives you the ability to set custom budgets that alert you when your costs or usage exceed (or are forecasted to exceed) your budgeted amount"
What advantages do you get from using the AWS cloud? (choose 2),1. Trade capital expense for variable expense,2. Stop guessing about capacity,3. Increased capital expenditure,4. Gain greater control of the infrastructure layer,5. Comply with all local security compliance programs,"1. Trade capital expense for variable expense, 2. Stop guessing about capacity","The 6 advantages of cloud are:
1 Trade capital expense for variable expense
2 Benefit from massive economies of scale 3 Stop guessing about capacity
4 Increase speed and agility
5 Stop spending money running and maintaining data centres 6 Go global in minutes
You do not gain greater control of the infrastructure layer as AWS largely control this, and though AWS is compliant with lots of security compliance programs, not all programs in all local countries will be included"
A company plans to create a hybrid cloud architecture. What technology will allow them to create a hybrid cloud?,1. VPC Peering,2. Internet Gateway,3. Direct Connect,4. Elastic Network Interface,,3. Direct Connect,"Direct connect provides a low-latency, high bandwidth connection to connect customer onpremise environments with the aws cloud which allows them to create a ""hybrid"" cloud architecture
VPC peering is a way of allowing routing between VPCs in different AWS accounts
An Internet Gateway is used to connect public subnets to the Internet (egress)
An Elastic Network Interface (ENI) is a logical networking component in a VPC that represents a virtual network card"
Which service supports the resolution of public domain names to IP addresses or AWS resources?,1. Amazon Route 53,2. Amazon CloudFront,3. Amazon SNS,4. Hosted Zones,,1. Amazon Route 53,"Amazon route 53 is a highly available and scalable domain name system (dns) service A hosted zone is a collection of records for a specified domain in Route 53
CloudFront is a content delivery network (CDN) that allows you to store (cache) your content at “edge locations” located around the world
Simple Notification Service is used to send notifications over multiple transport protocols"
What can you use to quickly connect your office securely to your Amazon VPC?,1. Route Table,2. Internet Gateway,3. Direct Connect,4. AWS managed VPN,,4. AWS managed VPN,"An aws managed vpn can be used to quickly connect from an office to an amazon vpc
Direct Connect provides high-bandwidth, low-latency connectivity but takes weeks to months to setup (and is much more expensive)
An Internet Gateway is used to connect a public subnet to the Internet (egress)
A Route Table is part of a VPC and is used to control how traffic is routed within the VPC"
What is the scope of a VPC within a region?,1. Spans all Availability Zones within the region,2. Spans all Availability Zones globally,3. At least 2 subnets per region,4. At least 2 data centers per region,,1. Spans all Availability Zones within the region,"A vpc spans all availability zones within a region
VPCs do not span regions, you create VPCs in each region
VPCs are not limited by subnets, subnets are created within AZs and you can have many subnets in an AZ
An AZ uses one or more data centers. AWS does not publicize the details"
Which type of Amazon Elastic Load Balancer operates at layer 7 of the OSI model?,1. Application Load Balancer,2. Network Load Balancer,3. Classic Load Balancer,4. F5 Load Balancer,,1. Application Load Balancer,"Application load balancer (alb) – layer 7 load balancer that routes connections based on the content of the request
Network Load Balancer (NLB) – layer 4 load balancer that routes connections based on IP protocol data
Classic Load Balancer (CLB) – this is the oldest of the three and provides basic load balancing at both layer 4 and layer 7
An F5 load balancer is not an Amazon load balancer"
Which services can help to automate a company's IT infrastructure? (choose 2),1. Amazon CloudWatch Alarms,2. Amazon Route 53,3. AWS Lambda Scheduled Events,4. Virtual Private Cloud,5. Elastic Network Interface,"1. Amazon CloudWatch Alarms, 3. AWS Lambda Scheduled Events","Amazon cloudwatch alarms – you can create a cloudwatch alarm that sends an amazon
Simple Notification Service (Amazon SNS) message when a particular metric goes beyond a specified threshold for a specified number of periods
AWS Lambda Scheduled events – These events allow you to create a Lambda function and direct AWS Lambda to execute it on a regular schedule
Amazon Route 53 is a DNS service and does not offer automation
A VPC is a logical networking construct and is not an example of automation
An ENI is a logical network adapter and is not an example of automation"
Which database service is a NoSQL type of database that is fully managed?,1. Amazon RDS,2. Amazon DynamoDB,3. Amazon RedShift,4. Amazon ElastiCache,,2. Amazon DynamoDB,"Dynamodb is amazon’s fully managed non-relational database service Amazon RDS is a relational (SQL) type of database
Amazon RedShift is a data warehouse that can be analyzed using SQL tools
Elasticache is a data caching service that is used to help improve performance"
Which storage service allows you to connect multiple EC2 instances concurrently using file-level protocols?,1. Amazon S3,2. Amazon EBS,3. Amazon EFS,4. Amazon Glacier,,3. Amazon EFS,"Amazon elastic file system allows you to connect hundreds or thousands of ec2 instances concurrently and is accessed using the file-level NFS protocol
Amazon Elastic Block Storage provides block-level volumes to individual EC2 instances (cannot connect multiple instances to a single EBS volume)
Amazon S3 is an object storage system and Glacier is used for archiving S3 objects"
For which services does Amazon not charge customers? (choose 2),1. Amazon VPC,2. Amazon EBS,3. Amazon CloudFormation,4. Amazon S3,5. Amazon SNS,"1. Amazon VPC, 3. Amazon CloudFormation","Amazon vpc and cloudformation are free of charge, however in the case of cloudformation you pay for the resources it creates
All other listed services are chargeable"
What architectural best practice aims to reduce the interdependencies between services?,"1. Services, Not Servers",2. Removing Single Points of Failure,3. Automation,4. Loose Coupling,,4. Loose Coupling,"As application complexity increases, a desirable attribute of an it system is that it can be broken into smaller, loosely coupled components. This means that IT systems should be designed in a way that reduces interdependencies—a change or a failure in one component should not cascade to other components
The concept of loos coupling includes ""well-defined interfaces"" which reduce interdependencies in a system by enabling interaction only through specific, technologyagnostic interfaces (e.g. RESTful APIs)"
Which AWS database service supports complex queries and joins and is suitable for a transactional database deployment?,1. Amazon RDS,2. Amazon DynamoDB,3. Amazon RedShift,4. Amazon EMR,,1. Amazon RDS,"Amazon rds supports complex queries and joins and is suitable for a transactional database deployment
Amazon DynamoDB is a NoSQL database and does not support to complex queries and joins
Amazon RedShift is a data warehouse used for analytic not transactional databases
Amazon EMR is a Hadoop service that is not suitable for transactional databases"
"Under the shared responsibility model, what are examples of shared controls? (choose 2)",1. Patch management,2. Storage system patching,3. Physical and environmental,4. Configuration management,5. Service and Communications Protection,"1. Patch management, 4. Configuration management","Shared controls– controls which apply to both the infrastructure layer and customer layers, but in completely separate contexts or perspectives
Patch Management– AWS is responsible for patching and fixing flaws within the infrastructure, but customers are responsible for patching their guest OS and applications
Configuration Management– AWS maintains the configuration of its infrastructure devices, but a customer is responsible for configuring their own guest operating systems, databases, and applications
Service and Communications Protection is an example of a customer specific control Storage system patching is an AWS responsibility
Physical and Environmental controls is an example of an inherited control (a customer fully inherits from AWS)"
How can an organization compare the cost of running applications in an on-premise or colocation environment against the AWS cloud?,1. AWS Budgets,2. AWS Simple Monthly Calculator,3. TCO Calculator,4. AWS Cost Explorer,,3. TCO Calculator,"The tco calculator is a free tool provided by aws that allows you to estimate the cost savings of using the AWS Cloud vs. using an on-premised data center
The AWS Cost Explorer is a free tool that allows you to view charts of your costs. You can view cost data for the past 13 months and forecast how much you are likely to spend over the next three months. Cost Explorer can be used to discover patterns in how much you spend on AWS resources over time and to identify cost problem area
The AWS Simple Monthly Calculator helps customers and prospects estimate their monthly AWS bill more efficiently
AWS Budgets gives you the ability to set custom budgets that alert you when your costs or usage exceed (or are forecasted to exceed) your budgeted amount"
What is the most cost-effective EC2 pricing option to use for a non-critical overnight workload?,1. On-Demand,2. Spot,3. Reserved Instance,4. Dedicated Host,,2. Spot,"Spot instances are good for short term requirements as they can be very economical. Sometimes AWS may terminate your instance, e.g. when the market price exceeds your bid price. This is a good option for non-critical workloads that can be terminated On-Demand is not the most economical option
Reserved instances are good for long-term, static requirements as you must lock-in for 1 or 3 years in return for a decent discount
Dedicated hosts provide a full server dedicated to a single customer and is therefore expensive"
Which service allows you to run code as functions without needing to provision or manage servers?,1. Amazon EC2,2. Amazon CodeDeploy,3. AWS Lambda,4. Amazon EKS,,3. AWS Lambda,"Aws lambda is a serverless computing technology that allows you to run code without provisioning or managing servers
Lambda is a serverless computing technology that allows you to run code without provisioning or managing servers
AWS CodeDeploy is a fully managed deployment service that automates software deployments to a variety of compute services such as Amazon EC2, AWS Lambda, and your on-premises servers
Amazon Elastic Container Service for Kubernetes (Amazon EKS) is a managed service that makes it easy for you to run Kubernetes on AWS without needing to stand up or maintain your own Kubernetes control plane"
