Question,Choice1,Choice2,Choice3,Choice4,Choice5,Answer,Explane
"Which service provides a way to convert video and audio files from their source format into versions that will playback on devices like smartphones, tablets and PCs?",1. Amazon Elastic Transcoder,2. AWS Glue,3. Amazon Rekognition,4. Amazon Comprehend,,1. Amazon Elastic Transcoder,"Amazon elastic transcoder is a highly scalable, easy to use and cost-effective way for developers and businesses to convert (or “transcode”) video and audio files from their source format into versions that will playback on devices like smartphones, tablets and PCs
AWS Glue is a fully managed extract, transform, and load (ETL) service that makes it easy for customers to prepare and load their data for analytics
Amazon Rekognition makes it easy to add image and video analysis to your applications
Amazon Comprehend is a natural language processing (NLP) service that uses machine learning to find insights and relationships in text"
Which AWS support plan comes with a Technical Account Manager (TAM)?,1. Basic,2. Developer,3. Business,4. Enterprise,,4. Enterprise,Only the enterprise plan comes with a tam
When using AWS Organizations with consolidated billing what are two valid best practices? (choose 2),1. Always enable multi-factor authentication (MFA) on the root account,2. Always use a straightforward password on the root account,3. The paying account should be used for billing purposes only,4. Use the paying account for deploying resources,5. Never exceed the limit of 20 linked accounts,"1. Always enable multi-factor authentication (MFA) on the root account, 3. The paying account should be used for billing purposes only","Best practices include:
- Always enable multi-factor authentication (MFA) on the root account - Always use a strong and complex password on the root account
- The Paying account should be used for billing purposes only. Do not deploy resources into the Paying account
There is a default limit of 20 linked accounts but this can be extended and there is no reason why you should stick to a maximum of 20 accounts"
Which statement best describes Amazon Route 53?,1. Amazon Route 53 is a service that enables routing within VPCs in an account,2. Amazon Route 53 is a highly available and scalable Domain Name System (DNS) service,3. Amazon Route 53 enables hybrid cloud models by extending an organization's on-premisenetworks into the AWS cloud,4. Amazon Route 53 is a service for distributing incoming connections between a fleet ofregistered EC2 instances,,2. Amazon Route 53 is a highly available and scalable Domain Name System (DNS) service,"Amazon route 53 is a highly available and scalable domain name system (dns) service The VPC router performs routing within a VPC
Direct Connect enables hybrid cloud models by extending an organization's on-premise networks into the AWS cloud
Auto Scaling is a service for distributing incoming connections between a fleet of registered EC2 instances"
Which type of AWS Elastic Load Balancer should be used if you want to route traffic to targets based on the content of the request such as DNS name or URL path?,1. Application Load Balancer (ALB),2. Network Load Balancer (NLB),3. Classic Load Balancer (CLB),4. AWS Auto Scaling,,1. Application Load Balancer (ALB),"Alb is best suited for load balancing of http and https traffic and provides advanced  request routing targeted at the delivery of modern application architectures, including microservices and containers. Operating at the individual request level (Layer 7), Application Load Balancer routes traffic to targets within Amazon Virtual Private Cloud (Amazon VPC) based on the content of the request
NLB is best suited for load balancing of TCP traffic where extreme performance is required. Operating at the connection level (Layer 4), Network Load Balancer routes traffic to targets within Amazon Virtual Private Cloud (Amazon VPC) and is capable of handling millions of requests per second while maintaining ultra-low latencies
CLB provides basic load balancing across multiple Amazon EC2 instances and operates at both the request level and connection level. Classic Load Balancer is intended for applications that were built within the EC2-Classic network AWS Auto Scaling is not a type of ELB"
Which data warehouse service can be used to query data in an Amazon S3 data lake without loading the data?,1. Amazon RDS,2. AWS Lambda,3. Amazon RedShift,4. Amazon EMR,,3. Amazon RedShift,"Amazon redshift extends data warehouse queries to your data lake, with no loading required. You can run analytic queries against petabytes of data stored locally in Redshift, and directly against exabytes of data stored in Amazon S3
Amazon RDS is not a data warehouse and cannot query data in S3 at rest AWS Lambda runs code as functions and is not a data warehouse
Amazon Elastic Map Reduce (EMR) provides a managed Hadoop service and cannot query data in S3 at rest"
Under the AWS shared responsibility model what is AWS responsible for? (choose 2),1. Physical security of the data center,2. Replacement and disposal of disk drives,3. Configuration of security groups,4. Patch management of operating systems,5. Encryption of customer data,"1. Physical security of the data center, 2. Replacement and disposal of disk drives","Aws are responsible for “security of the cloud”
Customers are responsible for “Security in the Cloud”
AWS are responsible for items such as the physical security of the DC, replacement of old disk drives, and patch management of the infrastructure
Customers are responsible for items such as configuring security groups, network ACLs, patching their operating systems and encrypting their data"
Which feature allows customers to route traffic via private IP addresses between two VPCs?,1. Endpoints,2. Network Address Translation,3. Virtual Private Gateway,4. Peering Connections,,4. Peering Connections,"A peering connection enables you to route traffic via private ip addresses between two peered VPCs
VPC endpoints enable private connectivity to services hosted in AWS, from within your VPC without using an Internet Gateway, VPN, Network Address Translation (NAT) devices, or firewall proxies 
A VPG is the Amazon side of a VPN connection
Network Address Translation (NAT) is used to translate IP addresses when routing between subnets that do not have a fully routable address space"
"Which AWS services can be used to create a ""stateless"" application? (choose 2)",1. Amazon DynamoDB,2. Amazon RDS,3. Amazon SWF,4. Load balancing with session affinity,5. Amazon EBS,"1. Amazon DynamoDB, 3. Amazon SWF","Stateless components include dynamodb which is often used for storing session state to maintain a stateless architecture and SWF which can be used for a multi-step workflow Databases such as RDS are considered stateful
Load balancing with session affinity can be used for horizontal scaling of stateful components
Amazon EBS is not a shared storage service so is not ideal for stateless architectures (use S3 or EFS instead)"
Which of the options below are recommendations in the security pillar of the well-architected framework? (choose 2),1. Enable traceability,2. Apply security at the application layer,3. Automate security best practices,4. Protect data when it is at rest only,5. Expect to be secure,"1. Enable traceability, 3. Automate security best practices","The security pillar includes the ability to protect information, systems, and assets while delivering business value through risk assessments and mitigation strategies There are six design principles for security in the cloud: - Implement a strong identity foundation - Enable traceability
- Apply security at all layers
- Automate security best practices
- Protect data in transit and at rest - Prepare for security events"
Which open-source technology allows you to build and deploy distributed applications inside of software containers?,1. Docker,2. Jenkins,3. Puppet,4. Chef,,1. Docker,"Docker allows you to package a piece of software in a docker image, which is a standardized unit for software development, containing everything the software needs to run: code, runtime, system tools, system libraries, etc. The other options are automation and orchestration tools"
Which of the advantages of cloud listed below is most closely addressed by the capabilities of AWS Auto Scaling?,1. Benefit from massive economies of scale,2. Stop guessing about capacity,3. Stop spending money running and maintaining data centers,4. Go global in minutes,,2. Stop guessing about capacity,Aws auto scaling helps you to adapt to the demand for you application and scale up and down as needed. This means you don't have to guess capacity upfront as you can provision what you need and allows Auto Scaling to manage the scaling
What does an organization need to do in Amazon IAM to enable user access to services being launched in new region?,1. Update the user accounts to allow access from another region,2. Create new user accounts in the new region,3. Enable global mode in IAM to provision the required access,"4. Nothing, IAM is global",,"4. Nothing, IAM is global",Iam is used to securely control individual and group access to aws resources. iam is universal (global) and does not apply to regions
What do Amazon S3 objects consist of? (choose 2),1. Key,2. Userdata,3. Value,4. ARN,5. AMI,"1. Key, 3. Value","Amazon s3 objects consist of: - Key (name of the object)
- Value (data made up of a sequence of bytes) - Version ID (used for versioning) 
- Metadata (data about the data that is stored)"
"Which type of EBS volume should you choose for an application that requires 12,000 IOPS from a single volume?",1. General Purpose SSD,2. Provisioned IOPS SSD,3. Throughput Optimized HDD,4. Cold HDD,,2. Provisioned IOPS SSD,"Provisioned iops ssd volumes support up to 32,000 iops whereas general purpose ssd only supports up to 10,000 per volume
Throughput Optimized HDD supports up to 500 IOPS and Cold HDD supports up to 250 IOPS per volume"
Which type of Amazon Route 53 record set should be used to map a zone apex record to an Amazon Elastic Load Balancer?,1. A,2. AAAA,3. CNAME,4. Alias,,4. Alias,"The alias record is a route 53 specific record type. alias records are used to map resource  record sets in your hosted zone to Amazon Elastic Load Balancing load balancers, Amazon
CloudFront distributions, AWS Elastic Beanstalk environments, or Amazon S3 buckets that are configured as websites. An Alias record can be used for resolving apex / naked domain names (e.g. example.com rather than sub.example.com)
A CNAME record can’t be used for resolving apex / naked domain name
An A record is a simple address record and an AAAA record is used for IPv6"
What is the most cost-effective Amazon S3 storage tier for data that is not often accessed but requires high durability?,1. Amazon S3 Standard,2. Amazon S3 Standard-IA,3. Amazon S3 One Zone-IA,4. Amazon Glacier,,3. Amazon S3 One Zone-IA,"S3 standard-ia is for data that is accessed less frequently, but requires rapid access when needed. S3 Standard-IA offers the high durability, high throughput, and low latency of S3 Standard
S3 One Zone-IA is for data that is accessed less frequently, but requires rapid access when needed. Unlike other S3 Storage Classes which store data in a minimum of three Availability Zones (AZs), S3 One Zone-IA stores data in a single AZ"
Which types of root storage devices are available for Amazon EC2 instances? (choose 2),1. EFS file system,2. EBS volume,3. S3 Bucket,4. Instance Store,5. RAM,"2. EBS volume, 4. Instance Store",The only storage options for a root volume that can be booted from are ebs volumes and Instance Stores
Which of the following are supported event sources for AWS Lambda? (choose 2),1. Amazon S3,2. Amazon EC2,3. Amazon DynamoDB,4. Amazon RedShift,5. AWS Direct Connect,"1. Amazon S3, 3. Amazon DynamoDB","An event source is an aws service or developer-created application that produces events that trigger an AWS Lambda function to run. Amazon S3 and DynamoDB are supported event sources for AWS Lambda
See the AWS link below for a full list of supported event sources"
"Which type of Amazon Route 53 routing policy allows you to specify a numerical value per IP address, totalling 100, that favors addresses with higher values?",1. Latency based,2. Failover,3. Weighted,4. Geo-location,,3. Weighted,"Similar to simple but you can specify a weight per ip address. you create records that have the same name and type and assign each record a relative weight. Numerical value that favors one IP over another and must total 100
Failover provides failover to a secondary IP address and is used for active-passive configurations
With latency based AWS maintains a database of latency from different parts of the world,  focusses on improving performance by routing to the region with the lowest latency
Geo-location Caters to different users in different countries and different languages. Contains users within a particular geography and offers them a customized version of the workload based on their specific needs. Geolocation can be used for localizing content and presenting some or all of your website in the language of your users"
Which statement is correct in relation to the AWS Shared Responsibility Model?,1. Customers are responsible for security of the cloud,2. AWS are responsible for encrypting customer data,3. Customers are responsible for patching storage systems,4. AWS are responsible for the security of regions and availability zones,,4. AWS are responsible for the security of regions and availability zones,"Aws are responsible for “security of the cloud”. aws is responsible for protecting the infrastructure that runs all of the services offered in the AWS Cloud. This infrastructure is composed of the hardware, software, networking, and facilities that run AWS Cloud services, and this includes regions, availability zones and edge locations
Customers are responsible for “Security in the Cloud”. This includes encrypting customer data, patching operating systems but not patching or maintaining the underlying infrastructure"
Which Amazon RDS deployment type is best used to enable fault tolerance in the event of the failure of an availability zone?,1. Multiple Availability Zones,2. Multiple Regions,3. Read Replicas,4. Write Replicas,,1. Multiple Availability Zones,"Multi az provides a mechanism to failover the rds database to another synchronously replicated copy in the event of the failure of an AZ
There is no option for multiple region failover of Amazon RDS
Read replicas are used for offloading read traffic from a primary database but cannot be used for writing and cannot be used to failover the primary database There is no such thing as write replicas"
"Which AWS service lets you add user sign up, sign-in and access control to web and mobile apps?",1. AWS Directory Service,2. AWS Cognito,3. AWS Artifact,4. AWS CloudHSM,,2. AWS Cognito,"Amazon cognito lets you add user sign-up, sign-in, and access control to your web and mobile apps quickly and easily. Amazon Cognito scales to millions of users and supports sign-in with social identity providers, such as Facebook, Google, and Amazon, and enterprise identity providers via SAML 2.0 AWS Directory Service for Microsoft Active Directory, also known as AWS Managed
Microsoft AD, enables your directory-aware workloads and AWS resources to use managed Active Directory in the AWS Cloud
AWS Artifact is your go-to, central resource for compliance-related information that matters to you
AWS CloudHSM is a cloud-based hardware security module (HSM) that enables you to easily generate and use your own encryption keys on the AWS Cloud"
Which of the options below are recommendations in the reliability pillar of the well-architected framework? (choose 2),1. Test recovery procedures,2. Manually recover from failure,3. Scale vertically using big systems,4. Stop guessing about capacity,5. Manage change in manual processes,"1. Test recovery procedures, 4. Stop guessing about capacity","The reliability pillar includes the ability of a system to recover from infrastructure or service disruptions, dynamically acquire computing resources to meet demand, and mitigate disruptions such as misconfigurations or transient network issues
There are five design principles for reliability in the cloud: - Test recovery procedures
- Automatically recover from failure
- Scale horizontally to increase aggregate system availability - Stop guessing capacity
- Manage change in automation"
Which AWS service is a Natural Language Processing (NLP) service that uses machine learning to find insights and relationships in text?,1. Amazon Transcribe,2. Amazon Comprehend,3. Amazon Rekognition,4. Amazon Sagemaker,,2. Amazon Comprehend,"Amazon comprehend is a natural language processing (nlp) service that uses machine learning to find insights and relationships in text. The service identifies the language of the text; extracts key phrases, places, people, brands, or events; understands how positive or negative the text is; analyzes text using tokenization and parts of speech; and automatically organizes a collection of text files by topic
Amazon Transcribe is an automatic speech recognition (ASR) service that makes it easy for developers to add speech-to-text capability to their applications
Amazon Rekognition makes it easy to add image and video analysis to your applications
Amazon SageMaker is a fully-managed platform that enables developers and data scientists to quickly and easily build, train, and deploy machine learning models at any scale"
Which of the following can be assigned to an IAM user? (choose 2),1. An access key ID and secret access key,2. A password for logging into Linux,3. A password for access to the management console,4. A key pair,5. An SSL/TLS certificate,"1. An access key ID and secret access key, 3. A password for access to the management console","An iam user is an entity that represents a person or service. users can be assigned an access key ID and secret access key for programmatic access to the AWS API, CLI, SDK, and other development tools and a password for access to the management console
Key pairs are used with Amazon EC2 as a method of using public key encryption to securely access EC2 instances
You cannot assign an IAM user with a password for logging into a Linux instance You cannot assign an SSL/TLS certificate to a user"
Which Amazon namespace is used to uniquely identify AWS resources?,1. AMI,2. API,3. ARN,4. ACL,,3. ARN,"Amazon resource names (arns) uniquely identify aws resources. we require an arn when you need to specify a resource unambiguously across all of AWS, such as in IAM policies, Amazon Relational Database Service (Amazon RDS) tags, and API calls
An application programming interface (API) is a set of subroutine definitions, communication protocols, and tools for building software
An Amazon Machine Image (AMI) provides the information required to launch an instance, which is a virtual server in the cloud
Amazon S3 access control lists (ACLs) enable you to manage access to buckets and objects"
"Which Amazon EC2 billing option allows gives you low cost, maximum flexibility, no upfront costs or commitment, and you only pay for what you use?",1. Reserved Instances,2. Spot Instances,3. Dedicated Host,4. On-Demand Instances,,4. On-Demand Instances,"With on-demand instances you pay for hours used with no commitment. there are no upfront costs so you have maximum flexibility 
Spot instances are used for getting a very low price which you bid on. You lose some flexibility as you are constrained by market prices and your workloads can be terminated if the market price exceeds your bid price
Reserved instances are based on a commitment to 1 or 3 years in exchange for a large discount
Dedicated hosts use physically dedicated EC2 servers to isolate your workloads and are expensive"
What is the difference between an EBS volume and an Instance store?,1. EBS volumes are object storage devices whereas Instance store volume are block based,2. Instance store volumes are ephemeral whereas EBS volumes are persistent storage,3. Instance store volumes can be used with all EC2 instance types whereas EBS cannot,4. EBS volumes are file-level storage devices whereas Instance store volumes are object-based,,2. Instance store volumes are ephemeral whereas EBS volumes are persistent storage,"Ebs-backed means the root volume is an ebs volume and storage is persistent. instance store-backed means the root volume is an instance store volume and storage is not persistent Both EBS and Instance store volumes are block-based storage devices
EBS volumes can be used with all EC2 instance types whereas Instance store volumes are more limited in compatibility"
Which of the below are valid use cases for using AWS services to implement real-time auditing? (choose 2),1. Use Amazon Inspector to monitor for compliance,2. Use Amazon CloudWatch for monitoring API calls,3. Use Amazon CloudTrail to monitor application performance,4. Use AWS IAM to store log files,5. Use AWS Lambda to scan log files,"1. Use Amazon Inspector to monitor for compliance, 5. Use AWS Lambda to scan log files","Amazon inspector is an automated security assessment service that helps improve the security and compliance of applications deployed on AWS. Amazon Inspector automatically assesses applications for exposure, vulnerabilities, and deviations from best practices
You can use AWS Lambda, Amazon EMR, the Amazon Elasticsearch Service, or third- party tools from the AWS Marketplace to scan logs to detect things like unused permissions, overuse of privileged accounts, usage of keys, anomalous logins, policy violations, and system abuse
CloudWatch is used for performance monitoring whereas CloudTrail is used for logging API calls
AWS IAM is not used for storage of log files"
Which Compute service should be used for running a Linux operating system upon which you will install custom software?,1. Amazon ECS,2. Amazon EC2,3. AWS Lambda,4. Amazon EKS,,2. Amazon EC2,"Amazon ec2 should be used when you need access to a full operating system instance
Amazon Elastic Container Service (ECS) and Amazon Elastic Container Service for Kubernetes (EKS) are used for running software containers, not full operating system instances
AWS Lambda runs code as functions in response to events"
What is the scope of an Amazon Virtual Private Cloud (VPC)?,1. It spans multiple subnets,2. It spans a single CIDR block,3. It spans all Availability Zones in all regions,4. It spans all Availability Zones within a region,,4. It spans all Availability Zones within a region,"A virtual private cloud (vpc) is a virtual network dedicated to your aws account. a vpc spans all the Availability Zones in the region
You can have multiple CIDR blocks in a VPC
A VPC spans AZs, subnets are created within AZs"
Which of the below are valid options within the VPC Wizard? (choose 2),1. VPC with Two Public Subnets,2. VPC with Private Subnets,3. VPC with a Single Public Subnet,4. VPC with Public and Private Subnets and Hardware VPN Access,5. VPC with a Private Subnet Only and Software VPN Access,"3. VPC with a Single Public Subnet, 4. VPC with Public and Private Subnets and Hardware VPN Access","The options available in the vpc wizard are: - VPC with a Single Public Subnet 
- VPC with Public and Private Subnets
- VPC with Public and Private Subnets and Hardware VPN Access
- VPC with a Private Subnet Only and Hardware VPN Access"
Which type of AWS Storage Gateway can be used to backup data with popular backup software?,1. File Gateway,2. Volume Gateway,3. Gateway Virtual Tape Library,4. Backup Gateway,,3. Gateway Virtual Tape Library,"The aws storage gateway service enables hybrid storage between on-premises environments and the AWS Cloud. The Gateway Virtual Tape Library can be used with popular backup software such as NetBackup, Backup Exec and Veeam. Uses a virtual media changer and tape drives
There is no such thing as a Backup Gateway in the AWS products
File gateway provides a virtual on-premises file server, which enables you to store and retrieve files as objects in Amazon S3
The volume gateway represents the family of gateways that support block-based volumes, previously referred to as gateway-cached and gateway-stored modes"
Which type of security control can be used to deny network access from a specific IP address?,1. Security Group,2. Network ACL,3. AWS WAF,4. AWS Shield,,2. Network ACL,"A network acl supports allow and deny rules. you can create a deny rule specifying a specific IP address that you would like to block A Security Group only supports allow rules
AWS WAF is a web application firewall
AWS Shield is a managed Distributed Denial of Service (DDoS) protection service"
Where can resources be launched when configuring AWS Auto Scaling?,1. Multiple AZs and multiple regions,2. Multiple AZs within a region,3. A single subnet,4. Multiple VPCs,,2. Multiple AZs within a region,Aws auto scaling is configured within the ec2 console and can launch instances within a VPC across multiple AZs. It cannot launch resources into another region
Which of the following security related activities are AWS customers responsible for? (choose 2),1. Installing patches on network devices,2. Implementing data center access controls,3. Implementing IAM password policies,4. Installing patches on Windows operating systems,5. Secure disposal of faulty disk drives,"3. Implementing IAM password policies, 4. Installing patches on Windows operating systems","Customers are responsible for configuring their own iam password policies and installing operating system patches on Amazon EC2 instances
AWS are responsible for installing patches on physical hardware devices, data center access controls and secure disposal of disk drives"
