Question,Choice1,Choice2,Choice3,Choice4,Choice5,Answer,Explane
Which configuration changes are associated with scaling vertically? (choose 2),1. Adding additional EC2 instances through Auto Scaling,2. Adding additional hard drives to a storage array,3. Adding a larger capacity hard drive to a server,4. Distributed processing,5. Changing an EC2 instance to a type that has more CPU and RAM,"3. Adding a larger capacity hard drive to a server, 5. Changing an EC2 instance to a type that has more CPU and RAM","Scaling vertically takes place through an increase in the specifications of an individual resource (e.g., upgrading a server with a larger hard drive or a faster CPU). On Amazon EC2, this can easily be achieved by stopping an instance and resizing it to an instance type that has more RAM, CPU, IO, or networking capabilities
Scaling horizontally takes place through an increase in the number of resources (e.g., adding more hard drives to a storage array or adding more servers to support an application)"
What are two ways an AWS customer can reduce their monthly spend? (choose 2),1. Turn off resources that are not being used,2. Use more power efficient instance types,3. Reserve capacity where suitable,4. Be efficient with usage of Security Groups,5. Reduce the amount of data ingress charges,"1. Turn off resources that are not being used, 3. Reserve capacity where suitable","Turning of resources that are not used can reduce spend. you can also use reserved instances to reduce the monthly spend at the expense of having to lock into a 1 or 3-year contract - good for stable workloads
You don't pay for power, security groups, or data ingress to the AWS cloud so these answers are all incorrect"
Which AWS services can be utilized at no cost? (choose 2),1. Identity and Access Management (IAM),2. Amazon VPC,3. Amazon S3,4. Amazon CloudFront,5. Amazon RedShift,"1. Identity and Access Management (IAM), 2. Amazon VPC",The only services that do not incur cost in this list are iam and vpc
Which types of AWS resource can be launched from a Golden Image? (choose 2),1. Amazon DynamoDB tables,2. Amazon EC2 instances,3. AWS Lambda functions,4. Amazon RDS instances,5. Amazon S3 objects,"2. Amazon EC2 instances, 4. Amazon RDS instances","Some resource types can be launched from a golden image. a golden image is a snapshot of a particular state for that resource. Examples are EC2 instances, RDS instances and EBS volumes"
"Using AWS terminology, which items can be created in an Amazon S3 bucket? (choose 2)",1. Folders,2. Files,3. Tables,4. Objects,5. Queues,"1. Folders, 4. Objects",You can create folders within buckets and can also upload objects As S3 is an object store you create objects not files Tables and queues cannot be created on S3
What are two ways of connecting to an Amazon VPC from an on-premise data center? (choose 2),1. VPC Peering,2. Direct Connect,3. VPN CloudHub,4. Internet Gateway,5. VPC Router,"2. Direct Connect, 3. VPN CloudHub","You can connect from your on-premise data center to a vpc via direct connect or vpn CloudHub
AWS Direct Connect is a network service that provides an alternative to using the Internet to connect a customer’s on-premise sites to AWS If you have multiple VPN connections, you can provide secure communication between sites using the AWS VPN CloudHub
Internet gateways and VPC routers are components of a VPC and are not used for connecting from external locations"
Which of the below is Amazon's proprietary RDS database?,1. MariaDB,2. MySQL,3. DynamoDB,4. Aurora,,4. Aurora,"Aurora is amazon’s proprietary database
MariaDB and MySQL can be used on RDS but they are not Amazon proprietary DynamoDB is an Amazon proprietary DB but it is not an RDS DB"
"A new user is unable to access any AWS services, what is the most likely explanation?",1. The user needs to login with a key pair,2. The services are currently unavailable,"3. By default, new users are created without access to any AWS services",4. The default limit for user logons has been reached,,"3. By default, new users are created without access to any AWS services","By default, new users are created with no access to any aws services – they can only login to the AWS console"
"Which of the following compliance programs allows the AWS environment to process, maintain, and store protected health information?",1. ISO 27001,2. PCI DSS,3. HIPAA,4. SOC 1,,3. HIPAA,"AWS enables covered entities and their business associates subject to the U.S. Health
Insurance Portability and Accountability Act of 1996 (HIPAA) to use the secure AWS environment to process, maintain, and store protected health information"
Which of the following services does Amazon Route 53 provide? (choose 2),1. Domain registration,2. Route tables,3. Domain Name Service (DNS),4. Auto Scaling,5. Load balancing,"1. Domain registration, 3. Domain Name Service (DNS)","Route 53 services include domain registration, dns, health checking (availability monitoring) and traffic management"
Which file format is used to write AWS Identity and Access Management (IAM) policies?,1. DOC,2. XML,3. JBOD,4. JSON,,4. JSON,"You manage access in aws by creating policies and attaching them to iam identities or aws resources. A policy is an object in AWS that, when associated with an entity or resource, defines their permissions. AWS evaluates these policies when a principal, such as a user,  makes a request. Permissions in the policies determine whether the request is allowed or denied. Most policies are stored in AWS as JSON documents"
Which of the following are valid types of Reserved Instance? (choose 2),1. Convertible RI,2. Discounted RI,3. Scheduled RI,4. Long-Term RI,5. Special RI,"1. Convertible RI, 3. Scheduled RI","Standard ris: these provide the most significant discount (up to 75% off on-demand) and are best suited for steady-state usage
Convertible RIs: These provide a discount (up to 54% off On-Demand) and the capability to change the attributes of the RI as long as the exchange results in the creation of Reserved
Instances of equal or greater value. Like Standard RIs, Convertible RIs are best suited for steady-state usage
Scheduled RIs: These are available to launch within the time windows you reserve. This option allows you to match your capacity reservation to a predictable recurring schedule that only requires a fraction of a day, a week, or a month"
At what level is a Network ACL applied?,1. Instance level,2. Region level,3. Availability Zone level,4. Subnet level,,4. Subnet level,Network access control lists (acls) provide a firewall/security layer at the subnet level Security Groups provide a firewall/security layer at the instance level
An architect needs to compare the cost of deploying an on-premise web server and an EC2 instance on the AWS cloud. Which tool can be used to assist the architect?,1. AWS Cost Explorer,2. AWS Budgets,3. AWS TCO Calculator,4. AWS Simple Monthly Calculator,,3. AWS TCO Calculator,"The tco calculator is a free tool provided by aws that allows you to estimate the cost savings of using the AWS Cloud vs. using an on-premised data center
The AWS Cost Explorer is a free tool that allows you to view charts of your costs
The AWS Simple Monthly Calculator helps customers and prospects estimate their monthly AWS bill more efficiently
AWS Budgets gives you the ability to set custom budgets that alert you when your costs or usage exceed"
Which AWS service provides preconfigured virtual private servers (instances) that include everything required to deploy an application or create a database?,1. AWS CloudFormation,2. Amazon Lightsail,3. Amazon ECS,4. AWS Lambda,,2. Amazon Lightsail,"Lightsail provides developers compute, storage, and networking capacity and capabilities to deploy and manage websites, web applications, and databases in the cloud
Lightsail includes everything you need to launch your project quickly – a virtual machine, SSD-based storage, data transfer, DNS management, and a static IP
Lightsail provides preconfigured virtual private servers (instances) that include everything required to deploy and application or create a database
CloudFormation is used to deploy resources through code, as a service it does not include preconfigured servers
Amazon Elastic Container Service (ECS) is a highly scalable, high performance container management service that supports Docker containers and allows you to easily run applications on a managed cluster of Amazon EC2 instances
Lambda is a serverless computing technology that allows you to run code without provisioning or managing servers"
"Which AWS service protects against common exploits that could compromise application availability, compromise security or consume excessive resources?",1. AWS WAF,2. AWS Shield,3. Security Group,4. Network ACL,,1. AWS WAF,"Aws waf is a web application firewall that protects against common exploits that could compromise application availability, compromise security or consume excessive resources 
AWS Shield is a managed Distributed Denial of Service (DDoS) protection service
Security groups and Network ACLs are firewalls protecting at the instance and subnet level respectively"
A Solutions Architect is launching a new EC2 instance that will be a web-server. Which EBS volume type provides a good balancer of price and performance and can be used as a system boot volume?,1. Cold HDD (sc1),2. Throughput Optimized (st1),3. General Purpose (gp2),4. Provisioned IOPS (io1),,3. General Purpose (gp2),"General purpose ssd provides a good balance of price to performance, is suitable for most workloads and can be used as a system boot volume
Provisioned IOPS SSD is a high-performance volume type that is more expensive and should be used for apps that require the higher performance
Cold HDD cannot be used as a boot volume and is good for throughput oriented storage for infrequently accessed data
Throughput Optimized volumes are ideal for streaming workloads with fast throughput such as big data and data warehouses"
Which Amazon S3 storage tier provides does not include a data retrieval fee and has an availability SLA of 99.99%?,1. S3 Standard,2. S3 Standard-IA,3. S3 One Zone-IA,4. Amazon Glacier,,1. S3 Standard,"All of the storage tiers listed include a data retrieval fee except for s3 standard
Availability SLAs are: S3 Standard = 99.99%; S3 Standard-IA = 99.9%; S3 One Zone-IA = 99%; Amazon Glacier = no SLA"
An organization would like to run managed desktops on the AWS cloud using the Windows 10 operating system. Which service can deliver these requirements?,1. Amazon EC2,2. Amazon Workspaces,3. Amazon SWF,4. Amazon does not provide desktop services,,2. Amazon Workspaces,"Amazon workspaces is a managed desktop computing service running on the aws cloud
WorkSpaces allows customers to easily provision cloud-based desktops that allow end-users to access documents and applications
WorkSpaces offers bundles that come with a Windows 7 or Windows 10 desktop experience, powered by Windows Server 2008 R2 and Windows Server 2016 respectively"
How can an organization assess applications for vulnerabilities and deviations from best practice?,1. Use AWS Artifact,2. Use AWS Inspector,3. Use AWS Shield,4. Use AWS WAF,,2. Use AWS Inspector,"Inspector is an automated security assessment service that helps improve the security and compliance of applications deployed on AWS. Inspector automatically assesses applications for vulnerabilities or deviations from best practices
AWS Artifact is your go-to, central resource for compliance-related information that matters to you
AWS Shield is a managed Distributed Denial of Service (DDoS) protection service AWS WAF is a web application firewall"
Which of the following is NOT one of the five AWS Trusted Advisor categories?,1. Cost Optimization,2. Performance,3. Security,4. Application transformation,,4. Application transformation,"The five categories are cost optimization, performance, security, fault tolerance and service limits"
"What features does Amazon RDS provide to deliver scalability, availability and durability? (choose 2)",1. Multi-AZ,2. Read Replicas,3. DB mirroring,4. Clustering,5. Multi-Subnet,"1. Multi-AZ, 2. Read Replicas","Multi-az rds creates a replica in another az and synchronously replicates to it (dr only) Read replicas are used for read heavy DBs and replication is asynchronous
DB mirroring, multi-subnet and clustering are not options provided by RDS"
Which of the following are AWS recommended best practices in relation to IAM? (choose 2),1. Assign permissions to users,2. Create individual IAM users,3. Embed access keys in application code,4. Enable MFA for all users,5. Grant least privilege,"2. Create individual IAM users, 5. Grant least privilege","Aws recommend creating individual iam users and assigning the least privileges necessary for them to perform their role
You should use groups to assign permissions to IAM users, should avoid embedding access keys in application code, and should enable MFA for privileged users (not everyone)"
What is an example of using loose coupling when designing an information system?,1. Synchronous replication,2. Proprietary interfaces,3. DNS name usage,4. Monolithic application architecture,,3. DNS name usage,"Dns names are used for service discovery. in loose coupling disparate resources must have a way of discovering each other without prior knowledge of the network topology
Asynchronous integration rather than synchronous replication is recommended so an interaction does not require an immediate response
You should use standard, technology-agnostic interfaces rather than proprietary interfaces where possible
A monolithic application architecture is not an example of loose coupling"
An architect wants to find a tool for consistently deploying the same resources through a templated configuration. Which AWS service can be used?,1. AWS Elastic Beanstalk,2. AWS CodeBuild,3. AWS CodeDeploy,4. AWS CloudFormation,,4. AWS CloudFormation,"Aws cloudformation provides a common language for you to describe and provision all the infrastructure resources in your cloud environment. CloudFormation allows you to use a simple text file to model and provision, in an automated and secure manner, all the resources needed for your applications across all regions and accounts
AWS CodeDeploy is a fully managed deployment service that automates software deployments to a variety of compute services such as Amazon EC2, AWS Lambda, and your on-premises servers
AWS CodeBuild is a fully managed continuous integration service that compiles source code, runs tests, and produces software packages that are ready to deploy
AWS Elastic Beanstalk is the fastest and simplest way to get web applications up and running on AWS"
Which of the following security operations tasks must be performed by AWS customers? (choose 2),1. Collecting syslog messages from physical firewalls,2. Issuing data center access keycards,3. Installing security updates on EC2 instances,4. Enabling multi-factor authentication (MFA) for privileged users,5. Installing security updates for server firmware,"3. Installing security updates on EC2 instances, 4. Enabling multi-factor authentication (MFA) for privileged users","The customer is responsible for installing security updates on ec2 instances and enabling
MFA. AWS is responsible for security of the physical data center and the infrastructure upon which customer services run"
At which layers of the OSI model do the different types of Elastic Load Balancers operate? (choose 2),1. Network Load Balancer at layer 4,2. Classic Load Balancer at layer 3,3. Application Load Balancer at layer 7,4. Network Load Balancer at layer 3,5. Application Load Balancer at layer 4,"1. Network Load Balancer at layer 4, 3. Application Load Balancer at layer 7","Application load balancer (alb) – layer 7 load balancer that routes connections based on the content of the request
Network Load Balancer (NLB) – layer 4 load balancer that routes connections based on IP protocol data
Classic Load Balancer (CLB) – this is the oldest of the three and provides basic load balancing at both layer 4 and layer 7"
Which AWS service can be used to host a static website?,1. Amazon S3,2. Amazon EBS,3. AWS Lambda,4. Amazon EFS,,1. Amazon S3,"Amazon s3 can be used to host static websites. it is not possible to use dynamic content. you can use a custom domain name if you configure the bucket name to match
The other services listed cannot be used to host a static website"
What type of storage is provided by Amazon EBS?,1. Block,2. File,3. Object,4. Relational,,1. Block,"Amazon elastic block storage (ebs) is block storage. this means you can mount the volume for operating systems and format and partition as if it is a local disk
File and object are other types of storage that you can use with AWS. File storage is provided by EFS and object storage is provided by Amazon S3
Relational is not a type of storage, it is typically used to describe a type of database such as RDS"
A manager needs to keep a check on his AWS spend. How can the manager setup alarms that notify him when his bill reaches a certain amount?,1. Using CloudWatch,2. Using AWS Trusted Advisor,3. Using CloudTrail,4. By notifying AWS support,,1. Using CloudWatch,The best ways to do this is to use cloudwatch to configure alarms that deliver a notification when activated. The alarms can use cost metrics that trigger the alarm when a certain amount of spend has been reached
Which of the following services allow root level access to the operating system? (choose 2),1. Amazon ElastiCache,2. Amazon EC2,3. Amazon SQS,4. Amazon EMR,5. Amazon SWF,"2. Amazon EC2, 4. Amazon EMR","In this list only ec2 and emr allow root level access to the operating system 
Question 42
You need to implement a hosted queue for storing messages in transit between application servers. Which service should you use? 1. Amazon SWF
2. Amazon SNS
3. Amazon SQS
4. Amazon DynamoDB 
Answer: 3
Explanation:
Amazon Simple Queue Service (Amazon SQS) is a web service that gives you access to message queues that store messages waiting to be processed. SQS offers a reliable, highlyscalable, hosted queue for storing messages in transit between computers. SQS is used for distributed/decoupled application
Amazon SWF helps developers build, run, and scale background jobs that have parallel or sequential steps
Amazon Simple Notification Service (SNS) is a highly available, durable, secure, fully managed pub/sub messaging service that enables you to decouple microservices, distributed systems, and serverless applications
Amazon DynamoDB is a nonrelational database that delivers reliable performance at any scale"
Which configuration changes are associated with scaling horizontally? (choose 2),1. Adding additional EC2 instances through Auto Scaling,2. Adding a larger capacity hard drive to a server,3. Changing the DB instance class on an RDS DB,4. Adding additional hard drives to a storage array,5. Changing an EC2 instance to a type that has more CPU and RAM,"1. Adding additional EC2 instances through Auto Scaling, 4. Adding additional hard drives to a storage array","Scaling horizontally takes place through an increase in the number of resources (e.g., adding more hard drives to a storage array or adding more servers to support an application)
Scaling vertically takes place through an increase in the specifications of an individual resource (e.g., upgrading a server with a larger hard drive or a faster CPU). On Amazon EC2, this can easily be achieved by stopping an instance and resizing it to an instance type that has more RAM, CPU, IO, or networking capabilities"
Which AWS construct provides you with your own dedicated virtual network in the cloud?,1. Amazon Workspaces,2. Amazon EC2,3. Amazon IAM,4. Amazon VPC,,4. Amazon VPC,"A virtual private cloud (vpc) is a virtual network dedicated to your aws account. a vpc is analogous to having your own DC inside AWS. It is logically isolated from other virtual networks in the AWS Cloud
Amazon WorkSpaces is a managed desktop computing service running on the AWS cloud
IAM is used to securely control individual and group access to AWS resources
Amazon Elastic Compute Cloud (Amazon EC2) is a web service that provides secure, resizable compute capacity in the cloud"
Which AWS network element allows you to assign a static IPv4 address to an EC2 instance?,1. Public IP,2. Elastic IP,3. Static IP,4. Dynamic IP,,2. Elastic IP,"An elastic ip address is a static ipv4 address designed for dynamic cloud computing. an
Elastic IP address is associated with your AWS account. With an Elastic IP address, you can mask the failure of an instance or software by rapidly remapping the address to another  instance in your account
An Elastic IP is a public IP however in the AWS cloud an elastic IP is the construct used to assign a public IP to an EC2 instance
Static IP and dynamic IP are terms used to describe IP addresses (public or private) that are either statically defined or dynamically obtained (through DHCP)"
An architect is creating a scalable application using AWS Auto Scaling. What needs to be created to enable a working configuration? (choose 2),1. Create a listener,2. Create an Auto Scaling group,3. Create a launch configuration,4. Create a target group,5. Create a listener rule,"2. Create an Auto Scaling group, 3. Create a launch configuration","To setup auto scaling, two of the tasks that need to be performed are to create a launch configuration and an Auto Scaling group
Listeners, listener rules and target groups are associated with Elastic Load Balancing"
A Solutions Architect is designing an application stack that will be highly elastic. What AWS services can be used that don’t require you to make any capacity decisions upfront? (choose 2),1. AWS Lambda,2. Amazon EC2,3. Amazon S3,4. Amazon RDS,5. DynamoDB,"1. AWS Lambda, 3. Amazon S3","With amazon s3 you don't need to specify any capacity at any time, the service scales in both capacity and performance as required
AWS Lambda lets you run code without provisioning or managing servers. You pay only for the compute time you consume - there is no charge when your code is not running
With Amazon EC2 you need to select your instance sizes and number of instances With RDS you need to select the instance size for the DB
With DynamoDB you need to specify the read/write capacity of the DB"
Which AWS service can assist with coordinating tasks across distributed application components?,1. Amazon STS,2. Amazon SQS,3. Amazon SWF,4. Amazon SNS,,3. Amazon SWF,"Amazon simple workflow service (swf) is a web service that makes it easy to coordinate work across distributed application components. SWF enables applications for a range of use cases, including media processing, web application back-ends, business process workflows, and analytics pipelines, to be designed as a coordination of tasks
Amazon Security Token Service (STS) is used for requesting temporary credentials
Amazon Simple Queue Service (SQS) is a message queue used for decoupling application components
Amazon Simple Notification Service (SNS) is a web service that makes it easy to set up, operate, and send notifications from the cloud
SNS supports notifications over multiple transports including HTTP/HTTPS, Email/EmailJSON, SQS and SMS"
What kinds of routing policies are available in Amazon Route 53? (choose 2),1. Simple,2. Failback,3. Fault tolerant,4. Latency,5. Shortest Path First,"1. Simple, 4. Latency","Route 53 routing policies include simple, weighted, latency based, failover, geo-location, Geo-Proximity, Multi-Value and Traffic Flow"
"An application stores images which will be retrieved infrequently, but must be available for retrieval immediately. Which is the most cost-effective storage option that meets these requirements?",1. Amazon Glacier with expedited retrievals,2. Amazon S3 Standard-Infrequent Access,3. Amazon EFS,4. Amazon S3 Standard,,2. Amazon S3 Standard-Infrequent Access,"Amazon Glacier with expedited retrievals is fast (1-5 minutes) but not immediate Amazon S3 Standard-Infrequent Access is the most cost-effective choice
Amazon EFS is a high-performance file system and not ideally suited to this scenario, it is also not the most cost-effective option
Amazon S3 Standard provides immediate retrieval but is not less cost-effective compared to Standard-Infrequent access"
What components can be managed in the Virtual Private Cloud (VPC) management console? (choose 2),1. Subnets,2. Elastic Load Balancers,3. Auto Scaling,4. IP CIDR,5. Snapshots,"1. Subnets, 4. IP CIDR","Within the management console for vpc you can manage items such as subnets and the ip CIDR block for the VPC
The other answers are all items that can be managed within the EC2 management console"
Which services are managed at a regional (rather than global) level? (choose 2),1. Amazon CloudFront,2. Amazon Route 53,3. Amazon S3,4. Amazon EC2,5. AWS IAM,"3. Amazon S3, 4. Amazon EC2","Both amazon ec2 and amazon s3 are managed at a regional level. note: amazon s3 is a global namespace but you still create your buckets within a region CloudFront, Route 52 and IAM and managed at a global level"
